{
  "schema_version": "parallax-signature-pack/v1",
  "id": "parallax.source-callees",
  "name": "Source callee signatures",
  "version": "0.1.0",
  "status": "experimental",
  "description": "Durable callee-to-atom mappings extracted from the Parallax reference engine rules tables.",
  "owners": [
    "parallax-taxonomy"
  ],
  "observation_gates": [
    {
      "id": "gate.exec.shell.javascript.child-process",
      "atom": "EXEC.SHELL",
      "languages": [
        "javascript"
      ],
      "requires_context": {
        "scope": "file",
        "any_text": [
          "child_process"
        ],
        "on_missing": "drop",
        "note": "Import/module evidence gate extracted from _IMPORT_GATES."
      }
    },
    {
      "id": "gate.exec.shell.typescript.child-process",
      "atom": "EXEC.SHELL",
      "languages": [
        "typescript"
      ],
      "requires_context": {
        "scope": "file",
        "any_text": [
          "child_process"
        ],
        "on_missing": "drop",
        "note": "Import/module evidence gate extracted from _IMPORT_GATES."
      }
    },
    {
      "id": "gate.exec.shell.tsx.child-process",
      "atom": "EXEC.SHELL",
      "languages": [
        "tsx"
      ],
      "requires_context": {
        "scope": "file",
        "any_text": [
          "child_process"
        ],
        "on_missing": "drop",
        "note": "Import/module evidence gate extracted from _IMPORT_GATES."
      }
    },
    {
      "id": "gate.exec.proc.go.os-exec",
      "atom": "EXEC.PROC",
      "languages": [
        "go"
      ],
      "requires_context": {
        "scope": "file",
        "any_text": [
          "os/exec"
        ],
        "on_missing": "downweight",
        "downweight_multiplier": 0.5,
        "note": "Import/module evidence gate extracted from _IMPORT_GATES."
      }
    },
    {
      "id": "gate.exec.proc.rust.std-process",
      "atom": "EXEC.PROC",
      "languages": [
        "rust"
      ],
      "requires_context": {
        "scope": "file",
        "any_text": [
          "std::process"
        ],
        "on_missing": "downweight",
        "downweight_multiplier": 0.5,
        "note": "Import/module evidence gate extracted from _IMPORT_GATES."
      }
    },
    {
      "id": "gate.load.import.java.classloader",
      "atom": "LOAD.IMPORT",
      "languages": [
        "java"
      ],
      "requires_context": {
        "scope": "file",
        "any_text": [
          "ClassLoader",
          "System.load",
          "forName",
          "loadLibrary",
          "reflect"
        ],
        "on_missing": "downweight",
        "downweight_multiplier": 0.5,
        "note": "Import/module evidence gate extracted from _IMPORT_GATES."
      }
    },
    {
      "id": "gate.load.import.kotlin.classloader",
      "atom": "LOAD.IMPORT",
      "languages": [
        "kotlin"
      ],
      "requires_context": {
        "scope": "file",
        "any_text": [
          "ClassLoader",
          "System.load",
          "forName",
          "loadLibrary",
          "reflect"
        ],
        "on_missing": "downweight",
        "downweight_multiplier": 0.5,
        "note": "Import/module evidence gate extracted from _IMPORT_GATES."
      }
    }
  ],
  "signatures": [
    {
      "id": "sig.exec.shell.universal.base.popen",
      "atom": "EXEC.SHELL",
      "surface": "callee",
      "method": "static-source",
      "languages": [
        "applescript",
        "batch",
        "c",
        "cpp",
        "csharp",
        "dockerfile",
        "elixir",
        "go",
        "groovy",
        "haskell",
        "hcl",
        "html",
        "java",
        "kotlin",
        "lua",
        "make",
        "objc",
        "perl",
        "php",
        "powershell",
        "r",
        "ruby",
        "rust",
        "scala",
        "shell",
        "sql",
        "swift",
        "vb"
      ],
      "match": {
        "mode": "base",
        "values": [
          "_popen",
          "_wpopen",
          "passthru",
          "popen",
          "shell_exec",
          "shellexecute",
          "shellexecutea",
          "shellexecutew",
          "system",
          "winexec"
        ],
        "normalize": [
          "lowercase",
          "member_separators"
        ]
      },
      "confidence": 0.78,
      "summary": "shell command execution",
      "priority": 50,
      "notes": "Extracted from _UNIVERSAL_RULES."
    },
    {
      "id": "sig.exec.shell.javascript.child-process-exec",
      "atom": "EXEC.SHELL",
      "surface": "callee",
      "method": "static-source",
      "languages": [
        "javascript",
        "typescript",
        "tsx"
      ],
      "match": {
        "mode": "exact_or_suffix",
        "values": [
          "exec",
          "execSync",
          "child_process.exec",
          "child_process.execSync",
          "cp.exec",
          "cp.execSync"
        ],
        "normalize": [
          "member_separators"
        ]
      },
      "confidence": 0.85,
      "summary": "shell command execution",
      "priority": 60,
      "notes": "child_process shell entry points; pairs with gate.exec.shell.javascript.child-process to drop RegExp.exec and local-helper false positives when no child_process evidence is present."
    },
    {
      "id": "sig.exec.proc.universal.base.createprocess",
      "atom": "EXEC.PROC",
      "surface": "callee",
      "method": "static-source",
      "languages": [
        "applescript",
        "batch",
        "c",
        "cpp",
        "csharp",
        "dockerfile",
        "elixir",
        "go",
        "groovy",
        "haskell",
        "hcl",
        "html",
        "java",
        "kotlin",
        "lua",
        "make",
        "objc",
        "perl",
        "php",
        "powershell",
        "r",
        "ruby",
        "rust",
        "scala",
        "shell",
        "sql",
        "swift",
        "vb"
      ],
      "match": {
        "mode": "base",
        "values": [
          "createprocess",
          "createprocessa",
          "createprocessw",
          "exec",
          "execl",
          "execle",
          "execlp",
          "execv",
          "execve",
          "execvp",
          "execvpe",
          "fork",
          "posix_spawn",
          "posix_spawnp",
          "proc_open",
          "processbuilder",
          "vfork"
        ],
        "normalize": [
          "lowercase",
          "member_separators"
        ]
      },
      "confidence": 0.78,
      "summary": "process execution",
      "priority": 50,
      "notes": "Extracted from _UNIVERSAL_RULES."
    },
    {
      "id": "sig.exec.proc.universal.substring.exec-command",
      "atom": "EXEC.PROC",
      "surface": "callee",
      "method": "static-source",
      "languages": [
        "applescript",
        "batch",
        "c",
        "cpp",
        "csharp",
        "dockerfile",
        "elixir",
        "go",
        "groovy",
        "haskell",
        "hcl",
        "html",
        "java",
        "kotlin",
        "lua",
        "make",
        "objc",
        "perl",
        "php",
        "powershell",
        "r",
        "ruby",
        "rust",
        "scala",
        "shell",
        "sql",
        "swift",
        "vb"
      ],
      "match": {
        "mode": "substring",
        "values": [
          "exec.command",
          "exec.commandcontext",
          "os/exec",
          "process.start",
          "runtime.exec",
          "start-process"
        ],
        "normalize": [
          "lowercase",
          "member_separators"
        ]
      },
      "confidence": 0.78,
      "summary": "process execution",
      "priority": 50,
      "notes": "Extracted from _UNIVERSAL_RULES."
    },
    {
      "id": "sig.load.eval.universal.base.eval",
      "atom": "LOAD.EVAL",
      "surface": "callee",
      "method": "static-source",
      "languages": [
        "applescript",
        "batch",
        "c",
        "cpp",
        "csharp",
        "dockerfile",
        "elixir",
        "go",
        "groovy",
        "haskell",
        "hcl",
        "html",
        "java",
        "kotlin",
        "lua",
        "make",
        "objc",
        "perl",
        "php",
        "powershell",
        "r",
        "ruby",
        "rust",
        "scala",
        "shell",
        "sql",
        "swift",
        "vb"
      ],
      "match": {
        "mode": "base",
        "values": [
          "eval",
          "function"
        ],
        "normalize": [
          "lowercase",
          "member_separators"
        ]
      },
      "confidence": 0.78,
      "summary": "dynamic code evaluation",
      "priority": 50,
      "notes": "Extracted from _UNIVERSAL_RULES."
    },
    {
      "id": "sig.load.eval.universal.substring.invoke-expression",
      "atom": "LOAD.EVAL",
      "surface": "callee",
      "method": "static-source",
      "languages": [
        "applescript",
        "batch",
        "c",
        "cpp",
        "csharp",
        "dockerfile",
        "elixir",
        "go",
        "groovy",
        "haskell",
        "hcl",
        "html",
        "java",
        "kotlin",
        "lua",
        "make",
        "objc",
        "perl",
        "php",
        "powershell",
        "r",
        "ruby",
        "rust",
        "scala",
        "shell",
        "sql",
        "swift",
        "vb"
      ],
      "match": {
        "mode": "substring",
        "values": [
          "invoke-expression"
        ],
        "normalize": [
          "lowercase",
          "member_separators"
        ]
      },
      "confidence": 0.8,
      "summary": "dynamic code evaluation",
      "priority": 50,
      "notes": "Extracted from _UNIVERSAL_RULES."
    },
    {
      "id": "sig.load.import.universal.base.dlopen",
      "atom": "LOAD.IMPORT",
      "surface": "callee",
      "method": "static-source",
      "languages": [
        "applescript",
        "batch",
        "c",
        "cpp",